	sourceLang	targetLang	sourceString	targetString	en-mt
1535	en	ti	 Religions prescribe hand washing for both hygienic and symbolic purposes.Symbolic hand washing, using water but no soap to wash hands, is a part of ritual hand washing featured in many religions, including Bahá'í Faith, Hinduism, tevilah and netilat yadayim in Judaism, Lavabo in Christianity, and Wudhu in Islam.Religions also prescribe hygienic hand washing, especially after certain actions. 	 ሃይማኖታት ኢድ ምሕጻብ ንጉዳይ ጽሬትን ምልክታዊ ተግባርን ዕላማ ገይሮም ይመኽሩ። ምልክታዊ ዝኾነ ኢድ ምሕጻብ፣ ኢድካ ብዘይ ሳሙና ብማይ ጥራሕ ምሕጻብ ዋላ ይኹን፣ ኣብ ናይ ባሃይ እምነት፣ ሂንዱይዝም፣ ኣብ ጁዱይዝም ዝርከቡ ቴቪላህን ኔቲላት ያዳይምን፣ ኣብ ክርስትና ዝርከብ ላቫቦ፣ ኣብ እስልምና ዝርከብ ዉድሁ ሓዊሱ፣ ኣብ ብዙሓት ሃይማኖታት ዝርከብ እምነታዊ ተገባር እዩ። ሃይማኖታት ብፍላይ ድሕሪ ገለ ተግባር ኢድካ ን ምጽራይ ምሕጻብ እውን ይመኽሩ እዮም። 	Religions recommend hand washing for hygiene issues and symbolic functions. Symbolic hand washing, whether it is washing your hands with only water without soap, is a religious practice in many religions, including Baha&#39;iism, Hinduism, Tevilah and Netilat Yadaim in Judaism, Lavabo in Christianity, and Wudhu in Islam. Religions also recommend washing your hands for cleansing, especially after some action.
1536	en	ti	 Hinduism, Judaism and Islam mandate washing of hands after using the toilet. 	 ሂንዱዝም፣ ጁዲዝምን እስላምን ድሕሪ ሽንት-ቤት ምጥቃም ኢድካ ምሕጻብ ሕጎም እዩ። 	Hinduism, Judaism and Islam prescribe washing hands after using the toilet.
1537	en	ti	 And, Hinduism, Buddhism, Sikhism, Judaism and Islam mandate washing of hands before and after every meal. 	 ከምኡ'ውን፣ ሂንዱዝም፣ ቡደሂዝም፣ ስኪዝም፣ ጁዲዝምን እስልምናን ቅድሚ ምግቢ ምብላዕ ኢድ ምሕጻብ የበረታትዑ። 	Also, Hinduism, Buddhism, Schism, Judaism and Islam encourage hand washing before eating.
1538	en	ti	 Workplace hazard controls for COVID-19 	 ናይ ስራሕ ቦታ ሓደጋ ቁጽጽር ናይ ኮቪድ-19 	Workplace risk control of COVID-1
1539	en	ti	 Workplace hazard controls for COVID-19 are the application of occupational safety and health methodologies for hazard controls to the prevention of coronavirus disease 2019 (COVID-19). 	 ኣብ ስራሕ ቦታ ዝግበሩ ናይ COVID-19 ሓደጋታት ቁጽጽራት ማለት ንምክልኻል ሕማም ኮረና ቫይረስ 2019(COVID-19) ዘገልግሉ ናይ ስራሕ ቦታ ድሕንነታትን ን ናይ ሓደጋ ቁጽጽር መንገዲታት ምትግባር ማለት እዩ። 	Workplace COVID-19 risk controls mean the implementation of workplace safety and risk control measures to prevent the spread of the coronavirus 2019(COVID-19).
1540	en	ti	 The proper hazard controls in the workplace depend on the worksite and job task, based on a risk assessment of sources of exposure, disease severity in the community, and risk factors of individual workers who may be vulnerable to contracting COVID-19. 	 ኣግባባዊ ናይ ስራሕ ቦታ ናይ ሓደጋ ቁጽጽራት ኣብቲ ናይ ስራሕ ቦታን ዓይነት ስራሕን፣ ብመሰረት ናይ ምቅላዕ ሓደጋ ምንጪ ምርመራ፣ ናይቲ ከባቢ ናይቲ ሕማም ከቢድነት፣ ከምኡውን ናይ ንኮቪድ-19 ናይ ምቅላዕ ዕድሎም ሰፊሕ ዝኾኑ ሰባት ክቃልዑሎም ዝኽእሉ ምኽንያትን ዝተመርኮሰ እዩ። 	Appropriate workplace risk controls are based on the workplace and type of work, according to the source of exposure risk, the severity of the disease in the area, and the reasons for the exposure of people at high risk of exposure to COVID-1
1541	en	ti	 According to the U.S. Occupational Safety and Health Administration (OSHA), lower exposure risk jobs have minimal occupational contact with the public and other coworkers, for which basic infection prevention measures are recommended, including hand washing, encouraging workers to stay home if they are sick, respiratory etiquette, and maintaining routine cleaning and disinfecting of the work environment. 	 ናይ U.S. ስራሕ ድሕንነትን ጥዕናን ምምሕዳር (OSHA) ብዝበሎ መሰረት፣ ትሑትናይ ምቅላዕ ዕድል ዘለዎም ስራሕቲ ምስቲ ህዝቢ ወይ መሳርሕቲ ትሑት ምንኽኻእ ዘለዎም ኮይኖም፣ መሰረታዊ ናይቲ ረኽሲ ምክልኻል ስጉምቲታት ዝውሰድዎ፣ ከም ኢድ ምሕጻብ፣ ሰራሕተኛታት ክሓሙ ከለዉ ኣብ ገዛ ክጸንሑ ምግባር፣ ናይ መተንፈሲ ስነ ስርዓት፣ በቢ ግዚኡ ናይ ስራሕ ቦታ ምጽራይን ዲስኢንፌክት ምግባርን ዘካተቱ እዮም። 	According to the US Occupational Safety and Health Administration (OSHA), low-exposure jobs have low contact with the public or co-workers, and basic infection prevention measures are taken, such as hand washing, keeping employees home when they are sick, respiratory discipline, They include cleaning and disinfecting the work area periodically.
1542	en	ti	 Medium exposure risk jobs include those that require frequent or close contact with people who are not known or suspected with COVID-19, but may be infected due to ongoing community transmission or international travel. 	 ማእኸላይ ተቓላዕነት ሓደጋ ዘለዎም ስራሕቲ ምስ ብኮቪድ-19 ዝተጠርጠሩ ወይ ብዝተረጋገጸ ዝተተሓዙ ሰባት ብቐጥታ ብተደጋጋሚ ምንኽኻእ ክሰርሑ ዝገብሩ ስራሕቲ ዘካትቱ እዮም፣ በዚ ቀጻላይ ናይ ማሕበረ ሰባዊ ለበዳ ምኽንያት ወይ ናይ ዓለም ለኻዊ ምጉዕዓዝ ግን ክልከፉ ይኽእሉ። 	Moderate exposure risk occupations include occupations that require frequent direct contact with suspected or confirmed cases of COVID-19, but may become infected due to this ongoing community outbreak or international travel.
1543	en	ti	 This includes workers who have contact with the general public such as in schools, high-population-density work environments, and some high-volume retail settings. 	 እዚ ድማ ምስ ሓፈሻዊ ብዝሒ ህዝቢ ከም ቤት ትምህርቲታት፣ ልዑል ብዝሒ ህዝቢ ዝጽዕቖም ናይ ስራሕ ቦታታት፣ ከምኡውን ገለ ልዑል ብዝሒ ዘለዎም ናይ መሸጣ መሰንድኦታት ዝሰርሑ ሰራሕተኛታት እውን የካትት። 	This also includes employees who work with general populations such as schools, high-density workplaces, and some high-density sales channels.
1544	en	ti	 Hazard controls for this group, in addition to basic infection prevention measures, include ventilation using high-efficiency air filters, sneeze guards, and having personal protective equipment available in case a person with COVID-19 is encountered. 	 ናይ ሓደጋ ቁጽጽር ጉጅለ፣ ንናይ መሰረታዊ ናይዚ ረኽሲ ምክልኻል ስጉምቲታት ብተወሳኺ፣ ዝኾነ ሰብ ብኮቪድ-19 እንተታሒዙ ናይ ቬንትሌሽን ተጠቃሚነት ልዑል ናይ ኣየር መጻረይታት፣ ናይ ምህንጣስ መሸፈኒን ናይ ውልቃዊ መከላኸሊ ናውቲን ምጥቃም ይከኣል። 	Risk Control Team, in addition to the basic preventive measures of this infection, if anyone is infected with COVID-19 ventilation utilization high air purifiers, cough masks and personal protective equipment can be used.
1545	en	ti	 OSHA considers healthcare and mortuary workers exposed to known or suspected person with COVID-19 to be at high exposure risk, which increases to very high exposure risk if workers perform aerosol-generating procedures on, or collect or handle specimens from, known or suspected person with COVID-19. 	 OSHA ንዝተረጋገጸ ወይ ዝተጠርጠረ ናይ ኮቪድ-19 ሕሙም ዝጋለጹ ናይ ጥዕና ክንክንን ናይ ቀብሪ ስነስርዓት ሰራሕተኛታትን ልዑል ናይ ምቅላዕ ዕድል ከምዘለዎም ሓበሩ፣ እዞም ሰራሕተኛታት ናይ ኤሮሶል ዘምርቱ ምርመራታት ዘካይዱ እንተኾይኖም፣ ወይ ናይ ዝተረጋገጸ ወይ ዝተጠርጠረ ናይ ኮቪድ-19 ሕሙም ናሙናታት ዝእክቡ እንተኾይኖም ድማ ተቓላዕነቶም ይውስኾ። 	OSHA reported that health care and funeral workers who are exposed to a confirmed or suspected COVID-19 patient have a higher risk of exposure, and their exposure increases if these workers conduct aerosol-producing tests, or collect samples from a confirmed or suspected COVID-19 patient.
1546	en	ti	 Hazard controls appropriate for these workers include engineering controls such as negative pressure ventilation rooms, and personal protective equipment appropriate to the job task. 	 ናይዞም ሰራሕተኛታት ናይ ሓደጋ ምቁጽጻር ከም ኣሉታዊ ጸቕጢ ቨንትሌሽን ክፍሊታት፣ ከምኡውን ነቲ ስራሕ ኣግባባዊ ዝኾነ ውልቃዊ መከላኸሊ ናውቲ ዝኣመሰሉ ዝሓዘ ናይ ምህንድስና ቁጽጽር እውን ዘካተተ እዩ። 	The risk control of these workers also included engineering controls such as negative pressure ventilation compartments, and personal protective equipment appropriate for the job.
1547	en	ti	 COVID-19 outbreaks can have several effects within the workplace. 	 ናይ COVID-19 ለበዳ ኣብ ናይ ስራሕ ቦታ ብዙሕ ጽልዋታት ክህልዎ ይኽእል እዩ። 	The COVID-19 pandemic can have many impacts in the workplace.
1548	en	ti	 Workers may be absent from work due to becoming sick, needing to care for others, or from fear of possible exposure. 	 ሰራሕተኛታት ሓሚሞም፣ ንካልኦት ሰባት ክከናኸኑ ኢሎም፣ ወይ ንከይቃልዑ ፈሪሖም ካብ ስራሕ ክተርፉ ይኽእሉ እዮም። 	Employees may miss work because they are sick, to care for other people, or for fear of exposure.
1549	en	ti	 Patterns of commerce may change, both in terms of what goods are demanded, and the means of acquiring these goods (such as shopping at off-peak hours or through delivery or drive-through services). 	 ናይ ንግዲ ከይዲታት ብክልተ መልክእ ክቕየሩ ይኽእሉ`ዮም፣ እንደልዮም ነገራት ዘሎ ኣቐርቦትን ነዞም እንደልዮም ነገራት ድማ እረኽበሉ መገዲን ብዝምልከት (ከም ኣብ ናይ ዘይተለመዱ ሰዓታት ምዕዳግ ወይ ኣብ መኪናኻ ኮይንካ ኣገልግሎት ምርካብ)። 	Business processes can change in two ways, in terms of the availability of what we want and how I get these things (such as shopping during unusual hours or getting service in your car).
1550	en	ti	 Lastly, shipments of items from geographic areas severely affected by COVID-19 may be interrupted.An infectious disease preparedness and response plan can be used to guide protective actions. 	 ኣብ መወዳእታ፣ ካብ ብኮቪድ-19 ብኸቢዱ ዝተጎድኣ ሃገራት ዝግበሩ መጎዓዓዘዝያታት ክቋረጹ ክግበር ይኽእል እዩ።ናይ ተላባዒ ሕማም ምድላዋትን ናይ ምላሽ ትልሚታትን ናይ ምክልኻል ተግባራት ንምክያድ ክሕግዙ ይኽእሉ። 	Finally, transportation from countries severely affected by COVID-19 may be suspended. Infectious disease preparedness and response plans can help conduct preventive measures.
1551	en	ti	 Plans address the levels of risk associated with various worksites and job tasks, including sources of exposure, risk factors arising from home and community settings, and risk factors of individual workers such as old age or chronic medical conditions. 	 ውጥናት ን ምስ ናይ ስራሕ ቦታታትን ዕዮታትን ዝተሓሓዝ መጠን ሓደጋ፡ ምንጭታት ተቓላዕነት ዘጠቓለለ፡ ምስ ገዛን ናይ ሕበረተሰብ ኣቀማምጣን ዝተተሓሓዙ ናይ ሓደጋ መበገሲታትን፡ ከምኡ’ውን ምስ ነፍስወከፍ ሰራሕተኛ ዝተሓሓዙ ናይ ሓደጋ መበገሲታትን ከምእርጋን ወይ ድማ ሕዱር ሕክምናዊ ጸገማት ኣብ ግምት ዘእተው እዮም። 	Plans take into account the amount of risk associated with workplaces and occupations, including sources of exposure, risk factors related to home and community location, and risk factors associated with each employee such as aging or chronic medical problems.
1552	en	ti	 They also outline controls necessary to address those risks, and contingency plans for situations that may arise as a result of outbreaks. 	 ኣብ እዋን ምልዓል ለበዳ ክፍጠሩ ንዝኽእሉ ኩነታት ንምቁጽጽር፡ ነቶም ናይ ሓደጋን ወዝባዊ ውጥናት ንምፍላጥ ዘኽእሉ ቁጽጽራት ኣቐሚጦም ኣለው። 	They have put in place controls to identify the emergency and emergency plans to control situations that may arise during an outbreak.
1553	en	ti	 Infectious disease preparedness and response plans may be subject to national or subnational recommendations. 	 ናይ ተላባዕቲ ሕማማት ድልውነትን ምላሽ ትልሚን ንናይ ብሄራውን ክፋል ብሄራውን ምኽሪታት ተገዛኢ እዩ። 	Infectious disease preparedness and response planning is subject to ethnic and part-ethnic recommendations.
1554	en	ti	 Objectives for response to an outbreak include reducing transmission among staff, protecting people who are at higher risk for adverse health complications, maintaining business operations, and minimizing adverse effects on other entities in their supply chains. 	 ንለበዳ ምላሽ ናይ ምሃብ ዕላማታት ኣብ መንጎ ስታፍ ምልባዕ ምቕናስ፣ ንዝኸፈአ ጎድናዊ ናይ ጥዕና ሕልኽለኻት ተቓላዕቲ ዝኾኑ ሰባት ምክንኻን፣ ናይ ንግዲ ኦፕሬሽናት ምሕላው፣ ከምኡውን ኣብቲ ናይቲ ኣቕርቦት ሰንሰለት ዘለዉ ከጋጥሞም ዝኽእል ጎድናዊ ጽልዋታት ምቕናስ ዘካተተ እዩ። 	The objectives of responding to an outbreak included reducing contagion among staff, caring for people vulnerable to the worst side health complications, protecting business operations, and minimizing potential side effects for those in the supply chain.
1555	en	ti	 The disease severity in the community where the business is located affects the responses taken. 	 እቲ ንግዲ ናይ ዝርከበሉ ቦታ ናይ ሕማም ከቢድነት ነቲ ዝውስድ ምላሽ ይጸልዎ። 	The disease severity of where the business is located affects the response it takes.
1556	en	ti	 The hierarchy of hazard controls is a framework widely used in occupational safety and health to group hazard controls by effectiveness. 	 መቆጻጸሪ ቅድመ-ተኸተል ሓደጋ መብዛሕቲኡ ጊዜ፡ ኣብ ውሕስነት ስራሓት ጥዕናን ዝተሓሓዝ ኮይኑ ክሳዕ ዕቱብ ናይ ጉጅለ ሓደጋታት መቆጻጸሪ ስርሓት ዘለዎ ባይታ እዩ። 	Pre-accident control is often related to occupational safety and health and is the basis for controlling operations up to serious group accidents.
1557	en	ti	 Where COVID-19 hazards cannot be eliminated, the most effective controls are engineering controls, followed by administrative controls, and lastly personal protective equipment. 	 ናይ ኮቪድ -19 ሓደጋታት ክውገዱ ኣብ ዘይክእሉሉ፣ ብሉጻት ዝበሃሉ ቁጽጽራት ምህንድስናዊ ቁጽጽራት፣ ብምቅጻል ናይ ምምሕዳራዊ ቁጽጽራት፣ ኣብ መወዳእታ ድማ ውልቃዊ መከላኸሊ ናውቲታት እዮም። 	Where the risks of COVID-19 cannot be eliminated, the best controls are engineering controls, followed by administrative controls, and finally personal protective equipment.
1558	en	ti	 Engineering controls involve isolating employees from work-related hazards without relying on worker behavior, and can be the most cost-effective solution to implement. 	 ናይ ኢንጅነሪንግ ቁጽጽራት ኣብ ናይ ሰራሕተኛ ውልቃዊ ባህሪ ከይተደረኽካ ን ሰራሕተኛታት ካብቶም ምስ ስራሕ ዝተትሓዙ ሓደጋታት ምንጻል እንትኾን፡ ብደረጃ ዋጋ እቲ ኣዝዩ ዘዋጽእ ክትግበር ዝኽእል መፍትሒ እዩ። 	Engineering controls are the most cost-effective solution to isolate employees from work-related hazards without relying on employee personal behavior.
1559	en	ti	 Administrative controls are changes in work policy or procedures that require action by the worker or employer. 	 ምምሕዳራዊ ቁጽጽራት ኣብ ናይ ስራሕ ወይ ናይ ምህርቲ ዝግበሩ ናይ ፖሊሲ ለውጢታት ናይ ሰራሕተኛ ወይ ሓላፊ ስጉምቲ ዝደልዩ እዮም። 	Administrative controls are policy changes in operations or production that require employee or manager action.
1560	en	ti	 Personal protective equipment (PPE) is considered less effective than engineering and administrative controls, but can help prevent some exposures. 	 ውልቃዊ መከላኸሊ ናውቲ (PPE) ምስ ናይ ምህንድስናን ምምሕዳራዊን ቁጽጽራት ክነጻጸር ከሎ ትሑት እዩ፣ ገለ ምቅላዓት ግን ንምክልኻል ክጠቅም ይኽእል። 	Personal protective equipment (PPE) is low compared to engineering and administrative controls, but can be useful to prevent certain exposures.
1561	en	ti	 All types of PPE must be selected based upon the hazard to the worker, properly fitted as applicable (e.g., respirators), consistently and properly worn, regularly inspected, maintained, and replaced, as necessary, and properly removed, cleaned, and stored or disposed of to avoid contamination. 	 ኩሎም ዓይነታት ናይ ውልቀ መሐለዊ መሳርሒታት ንምምራጽ ብመሰረት ነቲ ሰራሕተኛ ክወርዶ ዝኽእል ሓደጋ፣ ብዝግባእ ዝገጥሙ ከከም ኣገባብራ(ንኣብነት፣ መሳርሒታት ምስትንፋስ), ብዘይምቁራጽ ብዝግባእ ዝግበር፣ ብስሩዕ ዝምርመር፣ ዝጽገን፣ ቅያር ዝግበረሉ፣ከም ኣድላይነቱ ብዝግባእ ክውገድ፣ ምልኽኻፍ ንምውጋድ ጽርየቱ ኣብ ዝሕለወሉ ዝዕቀብ ወይ ዝጎሓፍ ክኾኑ ኣለዎም። 	Select all types of personal protective equipment according to the potential hazard to the employee, properly fitted depending on the procedure(e.g., respirators), regularly maintained, regularly inspected, repaired, replaced,properly disposed of as necessary, stored or disposed of in hygienic conditions to avoid infection They must be.
1562	en	ti	 According to the U.S. Occupational Safety and Health Administration (OSHA), lower exposure risk jobs have minimal occupational contact with the public and other coworkers. 	 ብመሰረት ናይ U.S. ናይ ስራሕ ድሕንነትን ጥዕናን ምምሕዳር (OSHA)፣ ትሑት ናይ ተቓላዒነት ዕድል ዘለዎም ስራሕቲ ምስ ህዝቢን ምስ መሳርሕቲን ትሑት ናይ ምንኽኻእ ዕድል ዘለዎም እዮም። 	According to the US Occupational Safety and Health Administration (OSHA), jobs with a low chance of exposure are those with a low chance of contact with the public and with co-workers.
1563	en	ti	 Basic infection prevention measures recommended for all workplaces include frequent and thorough hand washing, encouraging workers to stay home if they are sick, respiratory etiquette including covering coughs and sneezes, providing tissues and trash receptacles, preparing for telecommuting or staggered shifts if needed, discouraging workers from using others' tools and equipment, and maintaining routine cleaning and disinfecting of the work environment. 	 ንኹሎም ናይ ስራሕ ቦታታት ዝምከር መሰረታዊ ናይ ረኽሲ ምክልኻል ስጉምቲታት ከም ብተደጋጋሚ ኢድ ብማይን ሳሙናን ምሕጻብ፡ ሰራሕተኛታት እንተ ሓሚሞም ኣብ ገዛ ንኽጸንሑ ምብርታዕ፡ ናይ ምስትንፋስኣካላት ሕግታት ከም ኣፍካ ሸፊንካ ምስዓልን ምህንጣስን ምኽባር፡ ሶፍትን ናይ ጎሓፍ መጠራቐሚን ምሃብ፡ ኣድላዪ ኣብ ዝኾነሉ ናይ ቴሌኮም መራኸቢታት ወይ ድማ ናይ ሺፍት ስርዓት ምዝርጋሕ፡ ሰራሕተኛታት ናይ ካልኦት ሰባት ኣቑሑን መሳርሒታትን ንከይጥቀሙ ምግባር፡ ኣብቲ ናይ ስራሕ ቦታ መዓልታዊ ጽሬት ምሕላውን ጸረ-ህዋስያን ምግባርን ምቕጻልን የጠቃልሉ። 	Basic disinfection measures recommended for all workplaces such as frequent hand washing with soap and water, encouraging employees to stay home if they are sick, following respiratory rules such as covering your mouth and coughing and sneezing, providing soft and garbage bins, telecommunications or Shifts include extending the system, ensuring that employees do not use other people’s goods and equipment, maintaining and maintaining daily hygiene and disinfection in the workplace.
1564	en	ti	 Prompt identification and isolation of potentially infectious individuals is a critical step in protecting workers, customers, visitors, and others at a worksite. 	 ኣላባዕቲ ውልቀሰባት ብቅልጡፍ ምልላይን ምፍላይን ንሰራሕተኛታት፣ ዓማዊል፣ በጻሕቲን ካልኦት ኣብቲ ናይ ስራሕ ቦታ ዘለዉን ሰባት ካብቲ ሕማም ኣብ ምክልኻል ወሳኒ ስጉምቲ እዩ። 	Prompt identification and isolation of infectious individuals is a critical step in protecting employees, customers, visitors, and others in the workplace from the disease.
1565	en	ti	 The U.S. Centers for Disease Control and Prevention (CDC) recommends that employees who have symptoms of acute respiratory illness are to stay home until they are free of fever, signs of a fever, and any other symptoms for at least 24 hours without the use of fever-reducing or other symptom-altering medicines, and that sick leave policies are flexible, permit employees to stay home to care for a sick family member, and that employees are aware of these policies. 	 ናይ ሕቡራት መንግስታት ኣሜሪካ( U.S.) ማእኸል ቁጽጽር ሕማም ን ምክልኻልን( CDC) ከቢድ ናይ ኣካለ ምስትንፋስ ጸገም ዘለዎም ሰራሕተኛታት ፡ ክሳብ ን ኣስታት 24 ሰዓታት ካብ ረስኒ፣ ምልክታት ረስኒ፣ ካብ ዝኾኑ ዓይነት ምልክታት ን ብዘይ ዝኾነ ይኹን ናይ ረስኒ መቐነሲ መድሓኒት ወይድማ ምልክታት ዝቕንሱ መድሓኒታት ከይተጠቐሙ ነጻ ዝኾኑ ኣብ ገዛ ንኽጸንሑ ይላቦ፡ ካልእ ድማ፡ ናይ ሕማም ፍቓድ ፖሊሲታት ድማ ስራሕተኛታት ኣብ ገዛ ንዘሎ ኣባል ስድራ ቤት ንኸተሓምሙ ብዘኽእል መልክዑ ክተዓጻጸፉ እዮም፣ ሰራሕተኛታት ድማ ነዞም ፖሊሲታት ክፈልጡዎም ይግባእ። 	The United States( US) Centers for Disease Control and Prevention( CDC) employees with severe respiratory problems , up to about 24 hours from cough, cough symptoms, from any symptoms and without any cough relievers or symptom relievers It encourages those who are exempt to stay home without using it, and sick leave policies will be adapted to allow employees to make a family member at home sick, and employees should be aware of these policies.
1566	en	ti	 According to OSHA, medium exposure risk jobs include those that require frequent or close contact within six feet (1.8 m) of people who are not known or suspected COVID-19 patients, but may be infected with SARS-CoV-2 due to ongoing community transmission around the business location, or because the individual has recent international travel to a location with widespread COVID-19 transmission. 	 ብመሰረት OSHA፣ ምእከላይ ተቓላዕነት ዕድል ዘለዎም ስራሕቲታት ምስ ዘይተፈለጡ ወይ ዝተጠርጠሩ ናይ ኮቪድ-19 ሕሙማት፣ እሞ ግን ብ SARS-CoV-2 በቲ ኣብ ናይ ንግዲ ቦታታት ዘጋጥም ዘሎ ማሕበረ ሰባዊ ምልባዕ፣ ወይ ናብ ናይ ኮቪድ-19 ሰፊሕ ምልባዕ ዘለዎም ሃገራት ብምጉዓዞም ዝተለኸፉ ክኾኑ ምስ ዝኽእሉ ሰባት ብተደጋጋሚ ወይ ብቐረባ ንኽክእ ኣብ ውሽጢ ሽድሽተ ጫማ (1.8 m) ርሕቐት ክኾኑ ዘገድድ ስራሕ ዘለዎም ሰባት እዮም። 	According to OSHA, moderately exposed jobs with unknown or suspected COVID-19 patients, but infected with SARS-CoV-2 by the community outbreak in businesses, or by travel to countries with widespread COVID-19 outbreaks People with jobs that require them to be within six feet (1.8 m) of frequent or close contact with able-bodied people.
