	sourceLang	targetLang	sourceString	targetString	en-mt
634	en	ti	 In contrast to the role of camels in the transmission of MERS-CoV, the role of pangolins, if there is any, in the transmission of SARS-CoV-2 is different. 	 በንጻሩ ድማ ኣብ ናይ MERS-CoV-2ምምሕልላፍ ፓንጎሊናት ዝጻወትዎ ተራ(ናይ ብሓቂ ተራ እንተሃልይዎ) ካብ ናይ ኣግማል ተራ ዝተፈልየ እዩ። 	Conversely, the role(if any) of pangolins in MERS-CoV-2 transmission is different from that of camels.
635	en	ti	 Particularly, pangolin beta-CoVs are highly pathogenic in pangolins. 	 ብፍላይ፣ ፓንጎሊን ቤታ -CoVs ኣብ ፓንጎሊናት ልዑል ሕማም ናይ ምስዓብ ክእለት ዘለዎም እዮም። 	Specifically, pangolin beta -CoVs are capable of causing high disease in pangolins.
636	en	ti	 They might be a dead-end host for SARS-CoV-2-related beta-CoVs, similar to civets in the case of SARS-CoV. 	 ልክዕ ከም ናይ SARS-CoV ዝባድ ኬዛት፣ ናይ መወዳእታ መሕደሪ ናይ SARS-CoV-2-ዝተተሓሓዘ ቤታ-CoVs ክኾኑ ይኽእሉ። 	Like severe cases of SARS-CoV, they can be the final residence of SARS-CoV-2-associated beta-CoVs.
637	en	ti	 Several possibilities for interspecies transmission of SARS-CoV-2 from animals to humans have to be ruled in or ruled out in future studies. 	 ዝተፈላለዩ ናይ SARS-CoV-2 ካብ እንስሳታት ናብ ሰባት ምምሕልላፍ መገድታት ኣብ ቐጻሊ ምርምራት ክትንተኑ ትጽቢት ይግበር። 	Various animal-to-human transmission routes of SARS-CoV-2 are anticipated to be analyzed in ongoing investigations.
638	en	ti	 First, bats could be the reservoir host of a SARS-CoV-2-related virus almost identical to SARS-CoV-2. 	 መጀመርያ፣ ለኻኺቶ ምስ ን SARS-CoV-2 ዝመስል ምስ SARS-CoV-2 ዝዛመድ ቫይረስን መሕደሪ ኮይኑ ከገልግል ይኽእል እዩ። 	First, the infection can serve as a host for SARS-CoV-2-like and SARS-CoV-2-related viruses.
639	en	ti	 Humans might share the ecological niche with bats through butchering or coal mining. 	 ሰባት ብምሕራድ ወይ ፈሓም ዕደና ምስ ለኻኺቶታት ኢኮሎጂካዊ ኒች ክካፈሉ ይኽእሉ። 	People can share ecological niches with insects through slaughter or charcoal mining.
640	en	ti	 Second, pangolins could be one of intermediate amplifying host to which a SARS-CoV-2-related virus had been newly introduced. 	 ብተወሳኺ ድማ ፓንጎሊን ዝተብሃለ እንስሳ ካብቶም ናይቲ ቫይረስ ዓቕሚ ዘጉልሑ ናይ ማእኸላይ ቫይረስ ተሸከምቲ እንሳታት ሓደ ብምዃኑ ንSARS-CoV-2 ዝመስል ቫይረስ ተረኺብዎ። 	In addition, the pangolin was found to be one of the intermediate vector animals highlighting the potential of the virus, resulting in the detection of a SARS-CoV-2-like virus.
641	en	ti	 Humans contract the virus through butchering and consumption of game meat. 	 እቲ ቫይረስ ናብ ሰባት ስጋ ኣብ ዝሓርድሉን ዝበልዕሉን ግዘ እዩ ዝሓልፎም። 	The virus is passed on to people when they slaughter and eat meat.
642	en	ti	 It is possible that many mammals including domestic animals are susceptible to SARS-CoV-2. 	 ዘቤታውያን እንስሳት ሓዊስካ ብዙሓት መጥወብቲ እንስሳት ን SARS-CoV-2 ተቓላዕቲ ክኾኑ ይኽእሉ እዮም። 	Many mammals, including domestic animals, may be susceptible to SARS-CoV-2.
643	en	ti	 A survey of domestic and wild animals for antibodies is warranted. 	 ኣብ ናይ ዱር እንስሳትን እንስሳት ዘቤትን ናይ ጸረ-ነፍሳት መጽናዕቲ ምግባር ኣድላዪ እዩ። 	Antibiotic studies in wildlife and domestic animals are necessary.
644	en	ti	 Third, as mentioned above, recombination and adaptation of SARS-CoV-2 might have occurred in a third species that has contact with both bats and pangolins. 	 ሳልሳይ፣ ኣብ ላዕሊ ከምዝተጠቐሰ፣ ናይ SARS-CoV-2 ምትሕውዋስን(recombination) ምልማድን ኣብ ሳልሳይ ዓሌት ዝተፈጠረ ክኸውን ይኽእል፣ ማለት ምስ ክልኢቶም ለኻኺቶን ፓንጎሊንን ርክብ እንተነይርዎ። 	Third, as mentioned above, SARS-CoV-2 recombination may have occurred in a third species, ie if it had contact with both the tick and the pangolin.
645	en	ti	 The search for the animal origins of SARS-CoV-2 is still on. 	 ናይ SARS-CoV-2 መበቆል እንስሳ ምድላይ ክሳብ ሕዚ ኣብ መስርሕ ይርከብ። 	The search for the animal of origin of SARS-CoV-2 is still in progress.
646	en	ti	 Apart from different types of the animal hosts, three major factors on the viral side are also important in facilitating CoVs to cross species barriers. 	 ካብ እዞም ዝተፈላለዩ ዓይነታት ናይ እንስሳ መዕቖቢ፣ CoVs ናብ ካልእ ዓሌት ንከይሰግር ንምግዳብ ሰለስተ ዓበይቲ ሜላታት ኣለዉ። 	From these different types of animal shelters, there are three major methods to limit the spread of CoVs to another species.
647	en	ti	 First of all, their relatively high mutation rates in RNA replication. 	 ቅድሚ ኹሉ፣ ኣብ RNA ምርባሕ(replication) ዘለዎም ልዑል ናይ ጀነቲካዊ ለውጢ(mutation) ንጽጽራዊ መጠን። 	First of all, their relatively high rate of genetic mutation in RNA replication.
648	en	ti	 In comparison to other single-stranded RNA viruses, the estimated mutation rates of CoVs could be regarded as “moderate” to “high” with an average substitution rate being ~10-4 substitution per year per site 2, depending on the phase of CoV adaptation to novel hosts. 	 ምስ ካልኦት ንጽል ገመድ ዘለዎም(single stranded) RNA ቫይረሳት ክወዳደር ከሎ፣ ናይ CoVs ምልዋወጥ መጠን(mutation rate) ካብ ማእኸላይ ክሳብ ዝለዓለ ከምዝኾነ ይሕሰብ። ኣብ ሳይት 2 ብኣቨሬጅ ኣብ ዓመት ~10-4 ናይ ምትካእ ፍጥነት ኣለዎ፣ ነዚ ድማ CoV ምስ'ቲ ሓድሽ ተሸካማይ ዘለዎ ምልምማድ ይዉስኖ። 	Compared to other single stranded RNA viruses, the mutation rate of CoVs is thought to be moderate to high. Site 2 has an average replacement rate of ~10-4 per year, which is determined by CoV&#39;s adaptation to the new carrier.
649	en	ti	 CoVs have a proof-reading exoribonuclease, deletion of which results in exceedingly high mutability and attenuation or even inviability. 	 CoVs proof-reading exoribonuclease ኣለዎም። ናይዚ ምጥፋእ ድማ ዝለዓለ ምልማድን ምቅይያርን ዋላ'ውን ሞት የስዕብ። 	CoVs have a proof-reading exoribonuclease. The loss of this leads to increased habituation and changes and even death.
650	en	ti	 Interestingly, the nucleotide analogue Remdesivir is known to suppress CoV replication through inhibition of this exoribonuclease and the RNA-dependent RNA polymerase. 	 እቲ ረምዲስቪር(Remdesivir) ተባሂሉ ዝጽዋዕ ናይ ኒኩሎታይድ ኣናሎግ ንኢክዞራይቦኒዩክሊዝን (exoribonuclease) ናይ RNA ጽግዕተኛ RNA ፖሊመሬዝን(RNA-dependent RNA polymerase) ደው ብምባል ምርባሕ CoVs ይከላኸል። 	The nucleotide analog remdesivir prevents the reproduction of CoVs by inhibiting exoribonuclease and RNA-dependent RNA polymerase.
651	en	ti	 Remdesivir is one of most promising anti-SARS-CoV-2 agents to be tested in clinical trials. 	 ካብ'ቶም ኣብ ክሊንካዊ መጽናዕቲ ዘለዉ ጸረ SARS-CoV-2 መድሃኒታት፣ እቲ ዝለዓለ ተስፋ ዘለዎ Remdesivir እዩ። 	Of the anti-SARS-CoV-2 drugs in clinical trials, the most promising is Remdesivir.
652	en	ti	 Nevertheless, mutation rates of CoVs are about a million times higher than those of their hosts. 	 እንተኾነ እውን፣ ናይ CoVs መጥነ ምልውዋጥ(mutation rate) ልዕሊ ናይ መሕደሪታቶም ብሚልዮናት ይበልጹ። 	However, the mutation rate of CoVs is millions of times higher than that of their hosts.
653	en	ti	 In addition, mutation rate is often high when CoVs are not well adapted to the host. 	 ብተወሳኺ ምስ መጸገዕቲ ዘይምልማድ ኣብዝህሉ ግዘ፣ CoVs ልዑል መጠነ ምልውዋጥ ይህልዎም። 	In addition, when there is no adaptation to dependencies, CoVs have a high degree of variability.
654	en	ti	 Compared to SARS-CoV with a high mutation rate, the mutation rate of SARS-CoV-2 is apparently lower, suggestive of a higher level of adaptation to humans. 	 ምስ ልዑል መጠነ ምልውዋጥ ዘለዎ SARS-CoV ምስዝወዳደር፣ ናይ SARS-CoV-2 መጠነ ምልውዋጥ ትሑት እዩ፣ እዚ ድማ ልዑል ምስ ሰባት ናይ ምልማድ ዓቅሚ ከመዘለዎ የርኢ። 	Compared to SARS-CoV, which has a high mutation rate, SARS-CoV-2 has a low mutation rate, indicating a high adaptability to humans.
655	en	ti	 Presumably, it has already been adapted to another host close to humans. 	 ምናልባት ናብ ሰባት ካብ ምስ ሰባት ምቅርራብ ዘለዎም እንስሳት ቀዲሙ ተመሓላሊፉ ክኸውን ይኽእል። 	It may have been transmitted to humans earlier than animals close to humans.
656	en	ti	 In addition to SARS-CoV-2, this also applies to MERS-CoV, which is well adapted to dromedary camels. 	 ልክዕ ከም SARS-CoV-2፣ እዚ እንኮላይ ን MERS-CoV እውን ይምልከት። MERS-CoV ምስ ድሮሜዳሪ ኣግማል ብጽቡቕ ዝተላመደ እዩ። 	Just like SARS-CoV-2, this even applies to MERS-CoV. MERS-CoV is well adapted to dromedary camels.
657	en	ti	 Theoretically, it is unlikely that genetic drift would render vaccines and antivirals against SARS-CoV-2 ineffective quickly. 	 ብዓይኒ ስነ ሓሳብ ብምራእ፣ እቲ ናይ ጀነቲክስ ኣፈላላይ ንSARS-CoV-2 ዝስራሕ ክታበት ወይ ድማ ጸረ-ቫይረስ መድሃኒታት ዘይዉጽኢታዊ ኣይገብሮን። 	From a theoretical point of view, the genetic differences do not make SARS-CoV-2 vaccines or antiviral drugs ineffective.
658	en	ti	 Second, the large RNA genome in CoVs exerts extra plasticity in genome modification for mutations and recombination, thereby increasing the probability for interspecies co-evolution, which is advantageous for the emergence of novel CoVs when the conditions become appropriate. 	 ካልኣይ፣ እቲ ኣብ CoVs ዘሎ ዓብዪ ናይ RNA ጄኖም፣ ኣብ ንጀነቲካዊ ለውጢ(mutations)ንጀነቲካዊ ምድቓል(recombination) ዝግበሩ ናይ ጄኖም ምምሕያሻት ተወሳኺ ተለጣጢነት ብምስዓብ፣ በዚ ድማ ዕድል ናይ ካብ ዓሌት ናብ ዓሌት ዝግበር ሓባራዊ ለውጢ(evolution) ይውስኽ፣ ኩነታት ኣብ ዝጥዕሙሉ እቲ ሓድሽ CoVs ንኽምዕብል ድማ ይጥዕሞ። 	Second, the large RNA genome in CoVs results in increased flexibility in genome modifications for mutations and recombination, thereby increasing the likelihood of species-to-species co-evolution, where conditions are favorable It suits the development of new CoVs.
659	en	ti	 This is supported by the copious unique open reading frames and protein functions encoded towards the 3′ end of the genome. 	 እዚ ድማ ኣብ ናይ 3’ ጫፍ ናይቲ ጄኖም ዝተቐመጡ ብዙሓት ፈለምቲ ናይ ንባብ ሳንዱቕ(reading frames)ን ስራሕ ፕሮቲንን ዝድግፍዎ ሓቂ እዩ። 	This is a fact supported by many pioneering reading frames and protein functions positioned at the 3&#39; end of the genome.
660	en	ti	 Third, CoVs randomly and frequently switch templates during RNA replication through a unique “copy-choice” mechanism. 	 ሳልሳይ ድማ ኣብ እዋን ምርባሕ RNA፣ CoVs ሃንደበታውን ብብዝሕን ቅርጾምን ቦትኦምን ይቕይሩ። 	Third, during RNA replication, CoVs abruptly and massively change their shape and position.
661	en	ti	 In a host that serves as the mixing vessel, strand switching occurs frequently during CoV RNA transcription. 	 ኣብ'ቲ መተሓዋወሲ ኮይኑ ዘገልግል መዕቖቢ እንስሳ፣ ኣብ እዋን CoV RNA ትራንስክሪፕሽን ናይ ስትራንድ ምቅይያር ብተደጋጋሚ ይፍጠር እዩ። 	In the host animal that serves as a mixture, strand changes occur frequently during CoV RNA transcription.
662	en	ti	 Highly homologous full-length and subgenomic RNAs could recombine to generate new CoVs. 	 ብጣዕሚ ዝመሳሰሉ ሙሉእ ቁመትን ሳብጀኖሚክን ዝኾኑ RNA ተጣሚሮም ሓድሽ CoVs ይፈጥሩ። 	Highly similar full-length and subgenomic RNAs are paired to form new CoVs.
663	en	ti	 Phylogenetic evidence of natural recombination has been found in both HCoV-HKU1 and HCoV-OC43, as well as animal CoVs such as bat SL-CoV and batCoV-HKU9. 	 ኣብ HCoV-HKU1ን HCoV-OC43ን ከምኡ'ዉን ኣብ ከም ለኻኺቶ SL-CoV and ለኻኺቶ CoV-HKU9 ዝኣመሰሉ ንእንስሳ ዘጥቅዑ CoVs ቫይረሳት ናይ ተፈጥራዊ ሪኮምብኔሽን ፋይሎጀነቲክስ መረዳእታ ተረኺቡ። 	Natural recombination phylogenetic data were obtained in HCoV-HKU1 and HCoV-OC43 and in animal-infecting CoVs viruses such as infectious SL-CoV and infectious CoV-HKU9.
664	en	ti	 Virus-host interaction in relation to transmission 	 ኣብ መንጎ መዕቖብን ቫይረስን ዘሎ ርክብ ምስ ተመሓላለፍነት ክነጻጸር ከሎ 	Relationship between host and virus compared to transmissibility
665	en	ti	 Besides three viral factors stated above, viral interaction with host receptor is another key factor influential on interspecies transmission. 	 ከም ተወሳኺ ናይ'ቶም ኣብ ላዕሊ ዝተጠቐሱ ሰለስተ ናይ ቫይረስ ረቛሒታት፣ እቲ ቫይረስ ምስ ናይ መሕደሪኡ ተቐበልቲ ዘለዎ ርክብ ንመንጎ ዓሌታዊ ተመሓላላፍነቱ ዝውስን ዓቢ ረቛሒ እዩ። 	In addition to the three viral factors mentioned above, the virus&#39;s relationship with its hosts is a major factor in determining its interracial transmission.
666	en	ti	 Herein, recombination of SARS-CoV is taken as a typical example, which also showed evidence of positive selection during interspecies transmission events. 	 ናይ SARS-CoV ጥምረት ከም ኣብነት ምዉሳድ ይከኣል እዩ። እዚ ድማ ኣብ እዋን መንጎ ዓሌታዊ ተመሓላላፍነት ኣወንታዊ ምርጫ ከምዝካየድ የረድእ። 	The SARS-CoV combination is an example. This suggests positive selection during interracial transmission.
667	en	ti	 Based on the comparative analysis between isolates of human and civet SARS-CoVs, SARS-CoV is thought to undergo rapid adaptation in different hosts, particularly with mutations at the RBD of the S protein. 	 ኣብ መንጎ ናይ ሰባትን ዝባድን SARS-CoVsዝተገበረ ንጽጽር , SARS-CoV ኣብ ዝተፈላለዩ መሕደሪታት ብቐሊሉ ከምዝለማመድ ኣርእዩ፣ ብፍላይ ናይ RBD ናይ S ፕሮቲን ጀነቲካዊ ለውጢ (mutations) ብምጥቃም። 	A comparison between human and zebrafish SARS-CoVs , showed that SARS-CoV readily adapts to a variety of niches, specifically using genetic mutations of the RBD of the S protein.
668	en	ti	 Generally, the RBD in the S protein of a CoV interacts with the cellular receptor and is intensely selected by the host antibody response. 	 ብሓፈሻ፣ ኣብ ናይ CoV S ፕሮቲን ዘሎ RBD ምስ እቲ ዋህዮኣዊ ተቐባሊ ይራኸብ እዩ፣ በቲ ናይ እቲ መሕደሪኡ ኣንቲቦዲ ምላሽ ድማ እዩ ዝምረጽ። 	Generally, the RBD in the CoV S protein interacts with the cellular host, and is selected by the antibody response of its host.
669	en	ti	 In SARS-CoV, the RBD is in the 318th to 510th amino acids on the S1 fragment, which binds to the human ACE2 as well as its coreceptors for viral entry. 	 ኣብ SARS-CoV፣ RBD ኣብ መበል 318 ክሳብ 510 ኣሚኖኣሲድ ኣብ S1 ፍራግመንት እዩ ዝርከብ፣ ምስ ናይ ሰባት ACE2 ን ተሓባበርቲ ተቐበልቱን ብምጥባቕ ድማ ንምእታው ቫይረስ ይሕግዝ። 	In SARS-CoV, the RBD is located at the 318th to 510th amino acids in the S1 fragment, and aids virus entry by binding to human ACE2 and its co-receptors.
670	en	ti	 The RBD of SARS-CoV is capable of recognizing the ACE2 receptors of various animals, including bat, civet, mouse and raccoon dog, allowing interspecies transmission of the virus. 	 እቲ ናይ SARS-CoV ዝኾነ RBD፣ ናይ ለኻኺቶ፣ ዝባድ፣ ኣንጭዋን ራኩንን ከልቢን ዘጠቓልል ዝተፈላለዩ እንስሳት ACE2 ተቐበልቲ ናይ ምፍላጥ ተኽእሎ ኣለዎ፣ እዚ ድማ መንጎ ዓሌታዊ ምምሕልላፍ ዘፍቅድ እዩ። 	The RBD of SARS-CoV has the potential to recognize ACE2 receptors of a variety of animals, including leeches, zebrafish, mice, and raccoons and dogs, allowing for interspecies transmission.
671	en	ti	 In fact, only 6 amino acid residues were observed to be different from human and civet viral isolates in the RBD and 4 of them locate in the receptor-binding motif for interaction with the ACE2 receptor. 	 ብርግጽ ኣብ'ቲ RBD ናይ ካብ ሰባትን ዝባድን ዝተወስዱ ቫይረሳትን፣ 6 ናይ ኣሚኖ ኣሲድ ጽራር(residue) ፍልልያት ጥራሕ ከምዘለዎ ተራእዩ፣ እቶም 4 ድማ ምስ ናይ ACE2 ተቐባሊ ዘራኽብ ሰፈር እዮም ዝርከቡ። 	Indeed, in the RBD of viruses derived from humans and Zbad, it was found to have only 6 amino acid residue differences, 4 of which are located in the neighborhood that binds to the ACE2 receptor.
672	en	ti	 Civet SARS-CoV has K479N and S487T mutations in its RBD, which might increase the affinity of the interaction of spike protein with human ACE2 receptor. 	 ናይ ዝባድ SARS-CoV K479N ን S487T ን ጀነቲካዊ ለውጢ(mutations) ኣብ RBD ኣለዎ፣ እዞም ስፓይክ ፕሮቲናት ምስ ናይ ሰብ ACE2 ተቐበልቲ ናይ ምትእትታው ዓቕሙ ልዑል ክገብሮ ይኽእል እዩ። 	Zbad SARS-CoV has K479N and S487T genetic changes(mutations) in the RBD, these spike proteins may enhance its ability to interact with human ACE2 receptors.
673	en	ti	 In other words, these two amino acid substitutions might be critical to viral adaption to humans. 	 ብካልእ ኣበሃህላ፣ እዞም ክልተ ናይ ኣሚኖ ኣሲድ ተተካእቲ ናይ'ቲ ቫይረስ ምስ ሰባት ዘለዎ ተለማማድነት ወሰንቲ ክኾኑ ይኽእሉ እዮም። 	In other words, these two amino acid substituents may be critical to the virus&#39; adaptability to humans.
674	en	ti	 It is noteworthy that SARS-CoV-2 shares the same cellular receptor with SARS-CoV. 	 SARS-CoVs-2 ምስ SARS-CoV ሓደ ዓይነት ናይ ዋህዮ ተቐባሊ ከምዘለዎም ትኹረት ክወሃቦ ይግባእ። 	It should be emphasized that SARS-CoVs-2 share the same cellular receptor as SARS-CoV.
675	en	ti	 A 30% difference between SARS-CoV-2 and SARS-CoV in the S1 unit of the S protein implicates that the binding affinity of its S protein with human ACE2 might have altered. 	 ኣብ S1 ዩኒት ናይ S ፕሮቲን ናይ 30% ፍልልይ ኣብ መንጎ SARS-CoV-2 ን SARS-CoV ን ዘሎ፣ S ፕሮቲኑ ምስ ናይ ሰባት ACE2 ናይ ምትሕሓዝ ዓቕሙ ከምዝልውጦ የርኢ። 	The 30% difference in the S1 unit of the S protein between SARS-CoV-2 and SARS-CoV, shows that its S protein modulates its ability to interact with human ACE2.
676	en	ti	 Indeed, a cryo-EM study indicates a 10- to 20-fold higher affinity of this binding than that between human ACE2 and SARS-CoV S protein. 	 ኣብ cryo-EM ዝተገብረ መጽናዕቲ ካብ ኣብ ሰባት ዝርከብ ACE2ን ናይ SARS-CoV S ፕሮቲን ዘለዎ ጥምረት ብ10 ክሳብ 20 ዕጽፊ ይልዕል። 	in cryo-EM studies is 10- to 20-fold higher than the combination of ACE2 and the SARS-CoV S protein in humans.
677	en	ti	 It will also be of interest to determine whether any other coreceptor might be required for SARS-CoV-2 transmission. 	 SARS-CoV-2 ንኽመሓላለፍ ካልእ ተወሳኺ ተቐባሊ ዘድሊ ምዃኑ እዉን ክነረጋግጽ ይግባእ። 	We should also confirm that another additional host is required for SARS-CoV-2 to be transmitted.
678	en	ti	 Intriguingly, HCoV-NL63 also binds to ACE2 but with a different part of S. 	 ብዘገርም ኩነታት፣ HCoV-NL63 ብዝተፈለየ ናይ S ክፋል ምስ ACE2 እውን ይተሓሓዝ እዩ። 	Surprisingly, HCoV-NL63 also binds to ACE2 through a separate S segment.
679	en	ti	 There exist many other HCoV receptors, such as aminopeptidase N for HCoV-229E, and 9-O-acetylated sialic acid for HCoV-OC43. 	 ብዙሓት ናይ HCoV ተቐበልቲ ኣለዉ ከም ኣሚኖፔፕቲዴዝ ኤን ን HCoV-229E ከምኡ ድማ 9-O-acetylated sialic acid ን HCoV-OC43። 	There are many HCoV receptors such as aminopeptidase N for HCoV-229E and 9-O-acetylated sialic acid for HCoV-OC43.
680	en	ti	 They might also account for successful adaptation of these CoVs in humans after interspecies transmission from their animal hosts. 	 ካብ ዝተፈላለዩ እንስሳት ናብ ደቂ ሰባት ዝሓልፉ CoVs ዕዉት ምልማድ ክህልዎም ይኽእል። 	CoVs passed from different animals to humans can have successful adaptation.
681	en	ti	 In addition to cellular receptors, the outcome of interspecies transmission of HCoVs is also governed by other host dependency and restriction factors. 	 ኣብ ናይ ዋህዮ ተቐበልቲ ብተወሳኺ፣ ካልኦት ናይ መዕቖቢ ጽግዕተኝነትን እገዳን ረቛሒታትንውጽኢታውነት ናይ መንጎ ዓሌታዊ ተመሓላላፍነት ናይ HcoVs ይጸልውዎ እዮም። 	In addition to cellular hosts, other host dependence and restriction factors affect the efficacy of interspecies transmission of HcoVs.
682	en	ti	 The divergence of these host proteins between humans and natural reservoir hosts of HCoVs such as bats, dromedary camels and rodents might constitute a barrier to interspecies transmission. 	 ኣብ መንጎ ሰባትን ተፈጥሮኣዊ መዕቖቢታት ናይ HCoVs ከም ለኻኺቶታት፣ ድሮሜዳሪ ኣግማልን ኣናጹን ዘሎ ናይ መዕቖቢ ፕሮቲን ፍልልያት፣ ንመንጎ ዓሌታዊ ምትሕልላፍ ዕንቅፋት ክኾኖ ይኽእል እዩ። 	Host protein differences between humans and natural hosts of HCoVs such as rodents, dromedary camels, and monkeys, may hinder interspecies transmission.
683	en	ti	 HCoVs have to usurp host dependency factors and subvert host restriction factors for a successful interspecies transmission. 	 HcoVs ዕዉት መንጎ ዓሌታዊ ምትሕልላፍ ንክህልዎ፣ ኣብ መዕቖቢ እንስሳ ዘለዉ ንጽግዕተኛነት ወሰንቲ ጉዳያትን ክቆጻጸርን ንገደብ ወሰንቲ ጉድያት ድማ ክስዕሮም ኣለዎ። 	For HcoVs to have successful interspecies transmission, dependency and key issues in shelter animals must be controlled and restrictive key issues must be overcome.
684	en	ti	 In this regard, molecular determinants in this important area of virus-host interaction remain to be identified and characterized. 	 በዚ ምኽንያት ኣብ'ቲ ናይ ቫይረስን መዕቆቢኡን ዘሎ ዝምድና፣ ኣብ ሞለኲላር ደረጃ ወሰንቲ ዝኾኑ ረቛሒታት ከነለልዮምን ከነጽንዖምን ይግባእ። 	For this reason, we need to identify and study the factors that are critical in the relationship between the virus and its host, at the molecular level.
685	en	ti	 An unbiased genome-wide screening of host dependency and restriction factors for SARS-CoV-2 using the state-of-the-art technology of CRISPR might be fruitful. 	 ናይ CRISPR ስልጡን ቴክኖሎጂ ብምጥቃም፣ ሚዛናዊ ዝኾነ ናይ እቲ መዕቆቢ ጄኖም-ሙሉእ ብምምርማር፣ ንSARS-CoV-2 ወሰንቲ ዝኾኑ ናይ ጽግዕተኝነትን ገደባትን ረቛሒታት ምፍታሽ ውጽኢታዊ ክኸውን ይኽእል እዩ። 	Using the hybrid technology of CRISPR, screening a balanced genome-whole of the host may be cost-effective to screen for the dependence and restrictive factors that are key to SARS-CoV-2.
686	en	ti	 Emergence of novel HCoVs: back to ground zero 	 ናይ እዚ ሓድሽ HcoVs ኣመጻጽኣ: ናብ መበገሲኡ ተመሊስካ ምኻድ 	The origins of this new HcoVs: going back to the origins
687	en	ti	 The diversity of bat CoVs provides ample opportunities for the emergence of novel HCoVs. 	 ኣብ መንጎ ናይ ለኻኺቶ CoVs ዝርከብ ፍልልያት ንኣመጻጽኣ ሓድሽ HcoVs ገፊሕ ዕድል ዝህብ እዩ። 	Differences among infectious CoVs provide ample opportunities for the emergence of new HcoVs.
688	en	ti	 In this sense, bat CoVs serve as the gene pool of HCoVs. 	 እዚ ማለት፣ ናይ ለኻኺቶ CoVs ከም መራብሒ ጂን ፑል ናይ HCoVs ክኾኑ ይኽእሉ ማለት እዩ። 	This means that, infectious CoVs can act as a breeding gene pool of HCoVs.
