	sourceLang	targetLang	sourceString	targetString	en-mt
1110	en	ti	 Sports events and seasons were cancelled.On 11 March, Trump announced travel restrictions for most of Europe, excluding the United Kingdom, for 30 days, effective 13 March. 	 ናይ ስፖርታዊ ምድላዋትን ወቕቲታት ተሰሪዞም ኣለዉ። ኣብ ማርች 11፣ ትራምፕ ን 30 መዓልቲታት ዝጸንሕ ካብ ማርች 13 ዝጅምር፣ ካብ እንግሊዝ ወጻኢ ንዘለዋ ንመብዛሕቲእን ናይ ኣውሮፓ ሃገራት ዝምልከት ናይ ጉዕዞ እገዳታት ኣዊጆም። 	Sports events and seasons have been cancelled. On March 11, Trump announced a 30-day travel ban on most European countries outside the UK, starting March
1111	en	ti	 The following day, he expanded the restrictions to include the United Kingdom and Ireland. 	 ኣብቲ ቀጻሊ መዓልቲ ነቲ እገዳ ን እንግሊዝን ኣየርላንድን ክሓውስ ገይሩ ኣግፊሕዎ እዩ። 	The following day he expanded the ban to include England and Ireland.
1112	en	ti	 On 13 March, he declared a national emergency, which made federal funds available to respond to the crisis. 	 ኣብ ማርች 13, ህጹጽ እዋን ኣዊጁ፣ እዚ ድማ ናይ ፌደራል ናይ ገንዘብ ድጋፍ ንቅልውላው መልሲ ንክህብ ገቢሩዎ እዩ። 	On March 13, he declared a state of emergency, which led to federal financial support in response to the crisis.
1113	en	ti	 Beginning on 15 March, many businesses closed or reduced hours throughout the U.S. to try to reduce the spread of the virus. 	 ካብ ማርች 15 ጀሚሩ፣ ብዙሓት ናይ ቢዝነስ ትካላት ናይ እቲ ቫይረስ ዝርጋሐ ንምቕናስ ክበሃል፣ ተዓጽዮም እዮም ውየድማ ኣብ መላእ ሕቡራት መንግስታት ኣሜሪካ ናይ ሰራሕ ሰዓተን ቀኒሰን እየን። 	Since March 15, many businesses have been closed and reduced their operating hours across the United States in an effort to reduce the spread of the virus.
1114	en	ti	 By 17 March, the epidemic had been confirmed in all 50 states and in the District of Columbia.On 23 March, it was reported that New York City had 10,700 cases of the coronavirus, more than the total number of cases in South Korea. 	 እስካብ ማርች 17፣ እቲ ለበዳ ኣብ ኩለን እተን 50 ስቴታትን ኣብ ኮለምቢያ ዲስትሪክትን ምህላው ተረጋጊጹ እዩ።ኣብ ማርች 23፣ ኣብ ኔውዮርክ ሲቲ ዘሎ ኣጠቓላሊ ዝተረጋገጹ ጉዳያት ቀጽሪ 10,700 በጺሑ፣ እዚ ድማ ኣብ ደቡብ ኮሪያ ካብ ዘለዉ ኣጠቓላሊ ጉዳያት ዝለዓለ እዩ። 	As of March 17, the outbreak has been confirmed in all 50 states and the District of Columbia.As of March 23, the total number of confirmed campus cases in New York City reached 10,700, the highest total in South Korea.
1115	en	ti	 On 25 March, the governor said that social distancing seemed to be working, as estimates of case doubling slowed from 2.0 days to 4.7 days. 	 ኣብ ማርች 25፡ እቲ ኣመሓዳሪ ምስቲ ናይ ጉዳያት ዕጽፊ ምኻን ካብ 2.0 መ ዓልቲታት ናብ 4.7 መዓልቲታት ክብ ምባሉ ፡እቲ ናይ ማሕበራዊ ርሕቐት እንሰርሐ ይመስል ክብል ገሊጹ ። 	On March 25, the governor said with the doubling of cases from 2.0 days to 4.7 days, the social distancing seems to be working.
1116	en	ti	 As of 28 March, there were 32,308 confirmed cases in New York City, and 672 people had died from the virus.On 26 March, the United States was reported to have more confirmed coronavirus infection cases than any other country in the world, including China and Italy.As of 8 April, 400,335 cases have been confirmed in the United States, and 12,841 people have died. 	 ካብ ማርች 28 ጀሚሩ ኣብ ኔውዮርክ ሲቲ 32,308 ዝተረጋገጹ ጉዳያት ነይሮም፣ 672 ሰባት ድማ በቲ ቫይረስ ሞይቶም። ኣብ ማርች 26፣ ሕቡራት መንግስታት ኣሜሪካ ን ቻይናን ጣልያንን ሓዊሱ፣ካብ ዝኾነ ናይ ዓለምና ሃገር ንላዕሊ ዝተረጋገጹ ጉዳያት ነይሮማ። ካብ ኣፕሪል 8 ጀሚሩ፣ ኣብ ሕቡራት መንግስታት ኣሜሪካ 400,335 ዝተረጋገጹ ጉዳያት እክህለዉ 12,841 ሰባት ድማ ሞይቶም እዮም። 	Since March 28, there have been 32,308 confirmed cases in New York City, and 672 people have died from the virus. On March 26, the United States had more confirmed cases than any other country in the world, including China and Italy. As of April 8, there have been 400,335 confirmed cases and 12,841 deaths in the United States.
1117	en	ti	 Per media reports on 30 March, U.S. President Trump has decided to extend social distancing guidelines until 30 April. 	 ከም ኣብ ማርች 30 ዝነበረ ናይ ሚድያ ጸብጻባት ናይ ሕቡራት መንግስታት ኣሜሪካ ፕሬዝደንት ትራምፕ ናይ ማሕበራዊ ርሕቐት መምርሒታት እስካብ ኣፕሪል 30 ክምዘናውሑዎ ተገሊጹ። 	As per media reports on March 30, US President Donald Trump has extended social distancing guidelines until April
1118	en	ti	 On the same day, the USNS Comfort, a hospital ship with about 1000 beds, made anchor in New York. 	 ኣብ ተምሳሳሊ መዓልቲ፣ USNS Comfort ዝተብሃለ ከባቢ 1000 ዓራታት ዝሓዘ መርከብ ሆስፒታል ኣብ ኔውዮርክ ምዕራፉ ገይሩ። 	On the same day, the USNS Comfort, a 1,000-bed hospital ship, docked in New York.
1119	en	ti	 On 3 April, the U.S. had a record 884 deaths due to the coronavirus in a 24-hour period. 	 ኣብ ኣፕሪል 3, ኣሜሪካ ኣብ ውሽጢ 24-ሰዓት 884 ሞት ብሰንኪ ኮሮናቫይረስ ኣመዝጊባ። 	On April 3, the United States recorded 884 deaths from the virus in 24-hours.
1120	en	ti	 In the state of New York the cases have exceeded 100,000 people on 3 April.The White House has been criticized for downplaying the threat and controlling the messaging by directing health officials and scientists to coordinate public statements and publications related to the virus with the office of Vice-President Mike Pence. 	 ኣብ ግዝኣት ኔውዮርክ እቶም ጉዳያት ኣብ ኣፕሪል 3 ካብ 100000 ሰባት በሊጾም ኣለው። ናይ ዋይት ሃውስ ነቲ ሓደጋ ኣንኢሱ ብምርኣዩ ን ብ ሰበ ስልጣን ጥዕና ን ሳይንቲስታትን ዝግበሩ መግለጺታት ን ምስ'ቲ ቫይረስ ዝተትሓሓዙ ሕትመታት ብ ቢሮ ምክትል ፕሬዝደንት ማይክ ፔንስ ኣቢላ ብምምራሑ ዝውቀሰሉ እዩ። 	In New York State, the cases exceeded 100,000 on April The White House is accused of downplaying the risk and directing statements by health officials and scientists and publications related to the virus through Vice President Mike Pence&#39;s office.
1121	en	ti	 Overall approval of Trump's management of the crisis has been polarized along partisan lines. 	 ኣጠቓላሊ ናይ ትራምፕ ነቲ ቅልውላው ዝሓዙሉ መንገዲ ብዘምልከት ብ ናይ ፓርቲያዊ መሰመር ዝፍለዩ ክልተ መርገጺታት ኣለው። 	Overall, there are two positions on Trump&#39;s approach to the crisis that differ along party lines.
1122	en	ti	 Some U.S. officials and commentators criticized the U.S. reliance on importation of critical materials, including essential medical supplies, from China. 	 U.S. ንእቶት ኣገደስቲ ናውቲ፡ብፍላይ ድማ ናውቲ ሕክምና፡ኣብ ልዕሊ ቻይና ምምርኳሳ ብገለ ናይ U.S. ሓለፍትታትን ጋዜጠኛታትን ተነቒፉ። 	The US&#39;s reliance on China for imports of essential goods, especially medical supplies, has been criticized by some US officials and journalists.
1123	en	ti	 An analysis of air travel patterns was used to map and predict patterns of spread and was published in The Journal of Travel Medicine in mid-January 2020. 	 ቅዲ ናይ ኣየር ጉኦዞ ብምርኣይ ዝርግሐ ናይ እቲ ቫይረስ ንምግማት ዝተገብረ መጽናዕቲ ኣብ ትራቭል መዲስን ጆርናል ኣብ መፋርቅ ጃኑዋሪ 2020 ተሓቲሙ። 	A study to predict the spread of the virus by looking at air travel patterns was published in the Travel Medicine Journal in mid-January
1124	en	ti	 Based on 2018 information from the International Air Transport Association, Bangkok, Hong Kong, Tokyo, and Taipei had the largest volume of travellers from Wuhan. 	 ባንክኮክ፡ ሆንግኮንግ፡ ቶክዮን ታይፐይ ካብ ዉሃን ዝበዝሐ ተመላለስቲ ዘለወን ሃገራት ምዃነን ኣብ 2018 ካብ ማሕበር ዓለምለሃዊ በረራ ዝተዘርግሐ ሓብሬታ ይገልጽ። 	Bangkok, Hong Kong, Tokyo and Taipei have the highest number of travelers from Wuhan in 2018, according to data released by the International Aviation Association.
1125	en	ti	 Dubai, Sydney, and Melbourne were also reported as popular destinations for people travelling from Wuhan. 	 ዱባይ፣ ሲድኒ ን ሜልቦርን ን ካብ ዉሃን ዝብገሱ ሰባት ወሩያት መብጽሒታት ኮይኖም ተጸብጺቦም ኣለዉ። 	Dubai, Sydney and Melbourne have been reported as popular destinations for people departing from Wuhan.
1126	en	ti	 Bali was reported as least able among the 20 most popular destination cities in terms of preparedness, while cities in Australia were considered most able.Australia released its Emergency Response Plan for Novel Coronavirus (COVID-19) on 7 February. 	 ብ መንጽር ድሉውነት ካብተን 20 ህቡባት ናይ በጻሕቲ ከተማታት ባሊ ኣብ ዝተሓተ እንትትቕመጥ፣ ኣብ ኣውስትራሊያ ዝርከባ ከተማታት ድማ ካብተን ብሉጻት ተመዲበን። ኣውስትራሊያ ን ኖቨል ኮርና ቫይረስ (COVID-19) ዝኸውን ናይ ህጹጽ ግዜ መልሲ መውሃቢ መድብ ኣብ ፈብሩዋሪ 7 ዕላው ገይራቶ እያ። 	In terms of readiness, Bali ranked at the bottom of the 20 most popular tourist cities, while cities in Australia were ranked among the best. Australia announced its emergency response plan for the novel coronavirus (COVID-19) on 7 February.
1127	en	ti	 It stated that much was yet to be discovered about COVID-19, and that Australia would emphasize border control and communication in its response to the pandemic. 	 ብዛዕባ ኮቪድ-19 ዝምልከትን ገና ብሕጂ ብዙሕ ዝፍለጥ ጉዳይ ከምዘሎ፣ ከምኡ ውን ኣውስትራሊያ ነዚ ላብዕ ሕማም ንምክልኻል ኣብ ዶብ ምዕጻውን ኣብ ርክባት ምግባርን ኣትኩሮት ብምሃብ ከም እትሰርሕ ተገሊጹ። 	There is still much to be learned about COVID-19, and Australia is working to prevent the spread of the disease by focusing on border closures and communications.
1128	en	ti	 On 21 March, a human biosecurity emergency was declared in Australia. 	 ብ21 ማርች ህጹጽ ኩነት ህዝባዊ ድሕነት ኣብ ኣውስትራልያ ተኣዊጁ። 	On 21 March, a public safety emergency was declared in Australia.
1129	en	ti	 Owing to the effective quarantine of public transport in Wuhan and Hubei, several countries have planned to evacuate their citizens and diplomatic staff from the area, primarily through chartered flights of the home nation, with Chinese authorities providing clearance. 	 ኣብ ውሃን ኣብ ናይ ሕዝባዊ መጎዓዝያታት ኣብዝተነበረ ጽፉፍ ናይ ኳራንታይን ስራሕቲ ዝተልዓለ ብዙሓት ሃገራት ዜጋታትን ናይ ዲፕሎማሲ ስራሕተኛታተን ብ ዋናነት ባዕለን ብዘዳለዋእን ቻርተር ኣውሮፕላናት ዜጋታትን ካብቲ ቦታ ንምውጻኣ መድብ ዝሓዛ እንትኾና ናይ ቻይና ሰብ መዚታት ድማ ሕጋዊ መሰነያታ ከሳልጡ እዮም። 	Due to the tight quarantine measures on public transport in Wuhan, many countries have planned to evacuate their citizens and diplomatic personnel on their own charter planes, while Chinese authorities will provide legal escort.
1130	en	ti	 Canada, the United States, Japan, India, Sri Lanka, Australia, France, Argentina, Germany, and Thailand were among the first to plan the evacuation of their citizens. 	 ካናዳ፡ ሕቡራት መንግስታት ኣሜሪካ፡ ጃፓን፡ ህንዲ፡ ስሪላንካ፡ ኣውስትራልያ፡ ፈረንሳ፡ ኣርጀንቲና፡ ጀርመንን ታይላንድን ካብተን ንደቂ ሃገሮም ንምጥርናፍ ዝተጓየያ ቀዳሞት ሃገራት እየን። 	Canada, the United States, Japan, India, Sri Lanka, Australia, France, Argentina, Germany and Thailand were among the first countries to rush to reunite their compatriots.
1131	en	ti	 Pakistan has said that it will not be evacuating any citizens from China. 	 ፓኪስታን ዝኾኑ ዓይነት ዜጋታት ካብ ቻይና ከምዘይተውጽእ ኣፍሊጣ። 	Pakistan has announced that it will not evacuate any kind of citizens from China.
1132	en	ti	 On 7 February, Brazil evacuated 34 Brazilians or family members in addition to four Poles, a Chinese person, and an Indian citizen. 	 ኣብ ፌብሩዋሪ 7 ብራዚል 34 ብራዚላውያን ውይድማ ናይ ስድራ ቤት ኣባላይ ምስ ኣርባዕተ ፖላንዳውያን፣ ሓደ ቻይናዊን፣ ሓደ ናይ ህንዲ ዜጋን ካብቲ ዝነበሩዎ ናብ ድሕንነቱ ዝተሓለወ ቦታ ኣንቀሳቒሳ። 	On February 7, Brazil evacuated 34 Brazilians, including four Poles, a Chinese and an Indian, to safety.
1133	en	ti	 The citizens of Poland, China, and India deplaned in Poland, where the Brazilian plane made a stopover before following its route to Brazil. 	 ናይ ፖላንድ ፣ ቻይና ን ህንዲን ዜጋታት ድሕሪ እታ ናይ ብራዚል ኣውሮፕላን ቅድሚ ናብ ብራዚል ምኻዳ ኣብ ፖላንድ ጻንሒት ምግባራ ፣ ኣብ ፖላንድ ክጸንሑ ክኢሎም እዮም ። 	Citizens of Poland, China and India were able to stay in Poland after the Brazilian plane made a stopover in Poland before flying to Brazil.
1134	en	ti	 Brazilian citizens who went to Wuhan were quarantined at a military base near Brasília. 	 ካብ ዉሃን ዝተመልሱ ብራዚላውያን ኣብ ጥቓ ብራዚልያ ዝርከብ ወተሓደራዊ መዓስከር ተወሺቦም ኣለዉ። 	Brazilians returning from Wuhan have been quarantined at a military camp near Brasilia.
1135	en	ti	 On the same day, 215 Canadians (176 from the first plane, and 39 from a second plane chartered by the U.S. government) were evacuated from Wuhan to CFB Trenton to be quarantined for two weeks. 	 ሽዑንሽዑ 215 ካናዳውያን(176 ኣብታ ቀዳመይቲ በረራ፡ 39 ድማ ኣብታ ካልኣይቲ ብመንግስቲ U.S. ዝተሓዝአት በረራ) ካብ ዉሃን ኣብ CFB Trenton ንክልተ ሰሙን ክውሸቡ ተወሲዶም። 	Immediately, 215 Canadians (176 on the first flight and 39 on the second US government-booked flight) were taken from Wuhan to CFB Trenton for two weeks of quarantine.
1136	en	ti	 On 11 February, another plane of 185 Canadians from Wuhan landed at CFB Trenton. 	 ብዕለት 11 ፌብሩዋሪ 185 ካናዳውያን ዝሓዘት ካብ ዉሃን ዝተበገሰት ኣየር ኣብ CFB Trenton ዓሊባ። 	On Feb. 11, an airliner carrying 185 Canadians from Wuhan landed at CFB Trenton.
1137	en	ti	 Australian authorities evacuated 277 citizens on 3 and 4 February to the Christmas Island Detention Centre, which had been repurposed as a quarantine facility, where they remained for 14 days. 	 ናይ ኣውስትራሊያ ሰበ ስልጣናት ኣብ ፌብሩዋሪ 3 ን 4 ን 277 ዜጋታት ካብ ካልኦት ሃገራት ናብ ክሪስማስ ኣይስላንድ ማእኸል ህንጸት ኣእትያ እያ። እዚ ናይ ህንጸት ማእኽል ድማ ብድጋሚ ክም ኳራንታይን ፋሲሊቲ ኮይኑ ተስሩሑ እዩ፣ እቶም ዜጋታት ድማ ኣብኡ ን 14 መዓልቲታት ጸኒሖም እዮም። 	Australian authorities brought 277 citizens from other countries to the Christmas Iceland construction center on February 3 and The construction center has been re-operated as a quarantine facility, and the citizens have been there for 14 days.
1138	en	ti	 A New Zealand evacuation flight arrived in Auckland on 5 February; its passengers (including some from Australia and the Pacific) were quarantined at a naval base in Whangaparoa, north of Auckland. 	 ናይ ኒውዝላንድ ናይ ነብሲ ኣድሕን በረራ ኣብ ኣኡክላንድ ኣብ ፌብሩዋሪ 5 በጺሑ፣ እቶም ተጉዓዝቲ (ገለ ካብ ኣውስትራሊያን ካብ ፓሲፊክን ዘጠቓለለ) ኣብ ሰሜናዊ ኡክላንድ ኣብ ዝርከብ ናይ ሓይሊ ባሕሪ ቤዝ ኳራንታይን ተገይሮም ኣለዉ። 	A New Zealand lifeboat flight arrived in Auckland on February 5, the passengers (which included some from Australia and from the Pacific) have been quarantined at a naval base north of Auckland.
1139	en	ti	 On 15 February, the United States announced that it would evacuate Americans aboard the cruise ship Diamond Princess. 	 ኣብ ፈብሩዋሪ 15፡ ዩናይትድ ስቴትስ ኣብ ዳይመንድ ፕሪንሰስ ናይ ተጉዓዝቲ መርክብ ዉሽጢ ዝርከቡ ኣሜሪካዉያን ከም እተውጽእ ኣፍሊጣ። 	On February 15, the United States announced it would evacuate Americans on board the Diamond Princess passenger ship.
1140	en	ti	 On 21 February, a plane carrying 129 Canadian passengers who had been evacuated from Diamond Princess landed in Trenton, Ontario. 	 ኣብ ፌብሩዋሪ 21, 129 ናብ ዓዶም ዝምለሱ ካናዳውያን ዝጸዓነት ኣውሮፕላን ኣብ ትሬንቶን፣ ኦንታርዮ ዓሪፋ። 	On February 21, a plane carrying 129 Canadians returning home crashed in Trenton, Ontario.
1141	en	ti	 In early March, the Indian government began evacuating its citizens from Iran.On 14 March a South African Airways aircraft chartered by the South African Government repatriated 112 South African citizens. 	 ኣብ መጀምሪያ ወርሒ ማርች፣መንግስቲ ህንዲ ዜጋታቱ ካብ ኢራን ምውጻእ ጀሚሩ። ኣብ ማርች 14 በ መንግስቲ ደቡብ ኣፍሪካ ኮንትራት ዝተትሓዘት ናይ መንገዲ ኣየር ደቡብ ኣፍሪካ ኣውሮፕላን 112 ዜጋታት ደቡብ ኣፍሪካ ናብ ሃገሮም መሊሳ። 	In early March, the Indian government began evacuating its citizens from Iran. On March 14, a South African Airlines plane contracted by the South African government repatriated 112 South Africans.
1142	en	ti	 Medical screening was performed prior to departure, and four South Africans who were showing signs of coronavirus were left behind to mitigate risk. 	 ቅድሚ በረራ ሕክምናዊ መርመራ ኣብ ዝተገብረሉ እዋን ኣርባዕተ ደቡብ ኣፍሪቃውያን ምልክታት ኮሮናቫረስ ስለዘርኣዩ ንድሕሪት ተሪፎም። 	Four South Africans were left behind after showing symptoms of the virus during pre-flight medical tests.
1143	en	ti	 Only South Africans who tested negative were repatriated. 	 ብመርመራ ነጻ ዝተብሃሉ ደቡብ ኣፍሪቃውያን ጥራይ’ዮም ንሃገሮም ክምለሱ ተፈቒድሎም። 	Only South Africans who tested positive were allowed to return home.
1144	en	ti	 Test results cleared all the South Africans, including the flight crew, pilots, hotel staff, police and soldiers involved in the humanitarian mission who, as a precautionary measure, all remained under observation and in quarantine for a 14-day period at The Ranch Resort. 	 ናይ ምርመራ ውጽኢታት ናይ በረራ ክሩ፣ ፓይለታት፣ ናይ ሆተል ሰራሕተኛታት፣ ፖሊስን ወታደራትን ሓዊሱ፣ ኣብቲ ሰብኣዊ ልኡኽ ዝተሳተፉ ኹሎም ደቡብ ኣፍሪካውያን ነጻ ምዃኖም ኣረጋጊጹ፣ ክም ኣካል ጥንቃቐ ድማ ፣ኩሎም ን 14 መዓልቲታት ኣብ ራንች ሪዞርት ኣብ ትሕቲ ክትትልን ኳርንታይንን ክጸንሑ ተገይሮም እዮም። 	Test results confirmed that all South Africans involved in the humanitarian mission, including flight crew, pilots, hotel staff, police and soldiers, were free and, as a precaution, they were all placed under surveillance and quarantine for 14 days at the ranch resort.
1145	en	ti	 On 20 March, the United States began to partially withdrawal its troops from Iraq due to the pandemic. 	 ብ20 ማርች፣ ሕብረት መንግስታት ወተሃደራቱ ካብ ኢራቅ ብሰንኪ ለበዳ በብቁሩብ ክስህብ ጀሚሩ። 	On March 20, the United Nations began gradually withdrawing troops from Iraq due to the outbreak.
1146	en	ti	 On 5 February, the Chinese foreign ministry stated that 21 countries (including Belarus, Pakistan, Trinidad and Tobago, Egypt, and Iran) had sent aid to China. 	 ብ5 ፌብሩዋሪ፡ 21 ሃገራት (ቤላሩስ፡ ፓኪስታን፡ ትሪኒዳድን ቶቤጎን፡ ግብጽን ኢራንን ዘጠቃለለ) ናብ ቻይና ረድኤት ከምዝሰደዳ ሚኒስተር ወጻኢ ጉዳያት ቻይና ሓቢሩ። 	On February 5, 21 countries (including Belarus, Pakistan, Trinidad and Tobago, Egypt and Iran) sent aid to China, according to the Chinese foreign minister.
1147	en	ti	 Some Chinese students at American universities joined together to help send aid to virus-stricken parts of China, with a joint group in the greater Chicago area reportedly managing to send 50,000 N95 masks to hospitals in the Hubei province on 30 January.The humanitarian aid organization Direct Relief, in coordination with FedEx, sent 200,000 face masks along with other personal protective equipment, including gloves and gowns, by emergency airlift to the Wuhan Union Hospital by 30 January. 	 ገላ ኣብ ኣሜሪካ ዩኒቨርስቲታት ዝመሃሩ ቻይናውያን ተምሃሮ፣ ናብ በቲ ቫይረስ ዝተጠቕዑ ቦታታት ቻይና ሓገዝ ንምልኣኽ ሓቢሮም። እቲ ዝዓበየ ናይ እቲ ጉጅለ ኣባላይ ኣብ ቺካጎ ኣከባቢ ዘለው እንትኾኑ፣ ናብ ሁበይ ግዝኣት ዝርከባ ሆስፒታላት ኣብ ጃኑዋሪ 30፣ 50,000 N95 ማስክታት ክልእኹ ክኢሎም እዮም። ናይ ሰብኣዊ ሓገዝ ትካል ቀጥታዊ ረድኤት ምስ FedEx ብምትሕግጋዝ ድማ 200000 ናይ ገጽ ማስክታት ግሎቫትን ጋውናትን ሓዊሱ ምስ ካልኦት ናይ ዓርሰ መክላኸሊ ኣቑሑት ናብ ዉሃን ዩኒየን ሆስፒታል ኣብ ጃኑዋሪ 30 ብ ናይ ህጹጽ ናይ ኣየር መጓዓዚ ክልእኹ ከኢሎም እዮም። 	Some Chinese students at US universities have offered to send aid to affected areas in China. The largest member of the group is in the Chicago area, and they were able to send 50,000 N95 masks to hospitals in Hubei province on January Humanitarian aid agency Direct Relief worked with FedEx to send 200,000 face masks, gloves and gowns, along with other protective items, to Wuhan Union Hospital on January 30 by emergency airlift.
1148	en	ti	" On 5 February, Bill and Melinda Gates announced a $100 million donation to the WHO to fund vaccine research and treatment efforts along with protecting ""at-risk populations in Africa and South Asia"". "	 ብ5 ለካቲት ቢልን መሊንዳን ጌትስ $100 ሚልዮን ንWHO ከምዘውፍዩ ሓቢሮም። እዚ ወፈያ ናብ ናይ ክታበት መጽናዕትታትን ናይ መድሓኒት ፈተነታትን ከምኡ’ውን ነቶም “ኣብ ሓደጋ ዘለዉ ህዝብታት ኣፍሪቃን ደቡብ ኤስያን” ንምክልኻል ዝዓለመ ምዃኑ ድማ ሓቢሮም። 	On February 5, Bill and Melinda Gates announced they would donate $100 million to the WHO. The donation is aimed at vaccine research and drug trials and to protect “at-risk peoples in Africa and South Asia,” he said.
1149	en	ti	 Interaksyon reported that the Chinese government donated 200,000 masks to the Philippines on 6 February, after Senator Richard Gordon shipped 3.16 million masks to Wuhan. 	 ሰነተር ሪቻርድ ጎርዶን 3.16 ሚልዮን ናይ ኣፍን ኣፍንጫን መሸፈኒ ማስክ ናብ ዉሃን ድሕሪ ምስዳዱ፡መንግስቲ ቻይና ብ6 ፌብሩዋሪ ንፊሊፒንስ 200,000 ናይ ኣፍን ኣፍንጫን መሸፈኒ ማስክ ከምዝለገሰ ኢንተርኣክስዮን ሓቢሩ። 	The Chinese government donated 200,000 masks to the Philippines on February 6 after Senator Richard Gordon sent 3.16 million masks to Wuhan, InterAction reported.
1150	en	ti	 On 19 February, the Singapore Red Cross announced that it would send $2.26 million worth of aid to China. 	 ኣብ ፌብሩዋሪ 19፣ ናይ ሲንጋፖር ቀይሕ መስቀል ናብ ቻይና $2.26 ሚልዮን ዋጋ ዘውጽእ ርዳእታ ከምዝልእኽ ኣፍሊጡ። 	On February 19, the Singapore Red Cross announced it would send $2.26 million in aid to China.
