	Unnamed: 0	sourceLang	targetLang	sourceString	targetString	stringID	url	license	translator_ID	translated
0	0	en	sw	about how long have these symptoms been going on?	je, dalili hizi zimekuwa zikiendelea kwa takriban muda gani sasa?	CMU_1:1	http://www.speech.cs.cmu.edu/haitian/text/1600_medical_domain_sentences.en	public	en_sw_0001	dalili hizi zimeendelea kwa muda gani?
1	1	en	sw	and all chest pain should be treated this way especially with your age	na maumivu ya kifua yanapaswa kutibiwa hivi hasa umri wako ukizingatiwa	CMU_1:2	http://www.speech.cs.cmu.edu/haitian/text/1600_medical_domain_sentences.en	public	en_sw_0001	na maumivu yote ya kifua yanapaswa kutibiwa kwa njia hii hasa kwa umri wako
2	2	en	sw	and along with a fever	pamoja na joto jingi mwilini	CMU_1:3	http://www.speech.cs.cmu.edu/haitian/text/1600_medical_domain_sentences.en	public	en_sw_0001	na pamoja na homa
3	3	en	sw	and also needs to be checked your cholesterol blood pressure	na pia kiwango chako cha kolesteroli na shinikizo la damu linapaswa kupimwa	CMU_1:4	http://www.speech.cs.cmu.edu/haitian/text/1600_medical_domain_sentences.en	public	en_sw_0001	na pia inahitaji kuangaliwa shinikizo la damu la cholesterol yako
4	4	en	sw	and are you having a fever now?	na je, una joto jingi mwilini sasa?	CMU_1:5	http://www.speech.cs.cmu.edu/haitian/text/1600_medical_domain_sentences.en	public	en_sw_0001	na una homa sasa?
