	Unnamed: 0	sourceLang	targetLang	sourceString	targetString	stringID	url	license	translator_ID	translated
0	0	en	pt-BR	about how long have these symptoms been going on?	por aproximadamente quanto tempo esses sintomas tem ocorrido?	CMU_1:1	http://www.speech.cs.cmu.edu/haitian/text/1600_medical_domain_sentences.en	public	en_pt-BR_0001	sobre quanto tempo esses sintomas estão acontecendo?
1	1	en	pt-BR	and all chest pain should be treated this way especially with your age	e a dor no peito deve ser tratada assim, principalmente na sua idade	CMU_1:2	http://www.speech.cs.cmu.edu/haitian/text/1600_medical_domain_sentences.en	public	en_pt-BR_0001	e toda dor no peito deve ser tratada dessa maneira, especialmente com a sua idade
2	2	en	pt-BR	and along with a fever	e junto com a febre	CMU_1:3	http://www.speech.cs.cmu.edu/haitian/text/1600_medical_domain_sentences.en	public	en_pt-BR_0001	e junto com uma febre
3	3	en	pt-BR	and also needs to be checked your cholesterol blood pressure	e também é necessário verificar seu colesterol e sua pressão sanguínea	CMU_1:4	http://www.speech.cs.cmu.edu/haitian/text/1600_medical_domain_sentences.en	public	en_pt-BR_0001	e também precisa ser verificada sua pressão arterial de colesterol
4	4	en	pt-BR	and are you having a fever now?	e você está com febre agora?	CMU_1:5	http://www.speech.cs.cmu.edu/haitian/text/1600_medical_domain_sentences.en	public	en_pt-BR_0001	e você está com febre agora?
